{
  "depot": "hub",
  "load_unit": "kg",
  "visits": [
    {
      "id": "a",
      "demand": 1
    },
    {
      "id": "b",
      "demand": 1
    },
    {
      "id": "c",
      "demand": 1
    },
    {
      "id": "d",
      "demand": 1
    }
  ],
  "vehicles": [
    {
      "id": "v1",
      "capacity": 2
    },
    {
      "id": "v2",
      "capacity": 2
    }
  ],
  "matrix": {
    "node_ids": [
      "hub",
      "a",
      "b",
      "c",
      "d"
    ],
    "unit": "meter",
    "model": "explicit_matrix",
    "rounding": "none",
    "values": [
      [
        0,
        2,
        3,
        4,
        6
      ],
      [
        2,
        0,
        1,
        3,
        5
      ],
      [
        3,
        1,
        0,
        2,
        3
      ],
      [
        4,
        3,
        2,
        0,
        2
      ],
      [
        6,
        5,
        3,
        2,
        0
      ]
    ]
  }
}
